id,url,account_name,following_count,follower_count,total_like_count,date,href,handle,description,hashtag,like_count,bookmark_count,share_count,comment_count,final_text
217_post,https://www.tiktok.com/@mizchiefmagikk/video/7244534632824179969,leah,342,32.7K,1.9M,2023-6-14,/@mizchiefmagikk,mizchiefmagikk,i always get asked for my reccs for korea so here are some of them ⋆ ˚｡⋆୨୧˚  and if u r looking for other fun things to do u can get 20% off activities on Pelago by Singapore Airlines (promo code: VISAPEL20)!!,"['travelwithvisa', 'korea', 'koreaitinerary', 'kpop', 'seoulvlog', 'creditcardtips']",7544,1766,134,26,listen to Korea for 52 days and these are three things I would recommend you guys to check out first of all take a day trip out of school I went to school cuz I was visiting a friend and we went to a really cute Cafe and I also got to check out we will not show extraordinary rule the next thing is to go to any kind of Hilltop Cafe the one I went to was touched her Cafe at 11:30 and I had a gorgeous view of the whole of Soul it was very very much
218_post,https://www.tiktok.com/@pikajew__/video/7182781658133826842,Jew,2018,3186,25.8K,2022-12-30,/@pikajew__,pikajew__,5 destinations you shouldn’t miss as a first-time visitor in Singapore!,"['singapore', 'travel', 'abroad', 'merlionpark', 'universalstudios', 'pinoy', 'foryou', 'foryoupage']",3032,1308,361,24,"5 months go to destinations when in Singapore as a tourist merlion park overlooking the marina bay sands, cable car best during sunset, gardens by the bay best at night time. universal studios for adrenaline junkies dont miss the mummy and battlestar galactica, polands bells of happiness located at mount faber"
219_post,https://www.tiktok.com/@nuvegroup/video/7244850208708857090,NuVe Group,8,533,6891,2023-6-15,/@nuvegroup,nuvegroup,"Stellar Room, Stellar Memories ✨","['hotelnuvestellar', 'nuvegroup', 'traveltok', 'travel', 'exploresingapore', 'visitsingapore', 'discoversingapore', 'singapore', 'sg', 'hotelsg', 'fyp', 'tiktoksg']",1595,475,168,8,stellar room hotel nuvo stellar lets check in up to our room stellar room complimentary minibar nespresso coffee as well time for a bath look at the colors all ready great views in the hustle and bustle
220_post,https://www.tiktok.com/@fadhil.abroad.diaries/video/7201294561279282433,Fadhil-Abroad-Diaries(FAD),1957,5458,44.4K,2023-2-18,/@fadhil.abroad.diaries,fadhil.abroad.diaries,"How it all started. Took a leap of faith, left Singapore, everything and everyone behind to pursue our couple goals.","['fyp', 'fypシ', 'livingabroad', 'travel', 'parenting', 'father']",27.3K,1945,1907,614,and of course if they're good people behind really really emotional for me but I decided to try some other things else like working in the vaccination Center and of course looking at other hospitals along the way and minuteswhat job is well finally the medical check-up was the final hurdle for us after that we've been goodbye to our family members which was really really sad for me but well we all have to follow our dreams right and that is what that leads to where we are today thank you so much guys for following to follow me more for my journey take care
221_post,https://www.tiktok.com/@sheneyney.xx/video/7200374366624861466,@shaynedmclngn on IG 🥀,431,1031,19.8K,2023-2-15,/@sheneyney.xx,sheneyney.xx,Travel Smart ika nga 😜 thanks sa eastwest and klook!! HAHAHA,"['traveltiktok', 'fyp', 'singapore', 'travelhacks']",2743,1210,549,110,hi guys sharing with you all our singapore travel considering singapore is such an expensive place
222_post,https://www.tiktok.com/@kelanasaka/video/7229609880519331080,Kelana Saka!🧚🏻‍♀️✨,202,78.2K,2.3M,2023-5-5,/@kelanasaka,kelanasaka," - Seruuu banget transit di Singapore hahahaa, banyak yang bisa di explore area bandaranya 🫶🏻 Welkam tooooo Kelana Saka edisi Hanoi Vietnam 🇻🇳🇻🇳 ","['kelanasaka', 'vietnam', 'singapore', 'travelingvietnam', 'traveler', 'explorevietnam']",2791,1184,132,93,Jam Transit Singapore travel vlog
223_post,https://www.tiktok.com/@louisetruman/video/7160721149498903814,Louise Truman,578,154.3K,12M,2022-10-31,/@louisetruman,louisetruman,how to spend a 12 hour layover in Singapore ✈️,"['singapore', 'solotravel', 'traveltips', 'fyp', 'traveltiktok', 'layover', 'singaporeairport', 'singaporelayover', 'singaporeairport', 'singaporeguide']",47.9K,12.6K,1399,147,Singapore for a 12-plus hour layover so I figured I should make a video on how to make the most of your time here because once you're done exploring the airport which is really cool you're going to want to grab an admission ticket to the cloud forest at Gardens by the bay give yourself at least an hour to explore this properly and make sure you go to the top of the water for the view is very cool from there it's a 5-minute walk to the Science Museum they've got some really cool interactive exhibits and then there is no better place to spend Sunset than the sky Park Observatory deck just make sure you head back down in time to catch the free light shows at the park in the marina and whilst he should also follow me for more travel tips
224_post,https://www.tiktok.com/@jessicavirodri/video/7227786847714315526,jess • travel & food guide,1033,432,30.5K,2023-4-30,/@jessicavirodri,jessicavirodri,Cheap eats in Singapore 🇸🇬 if you’re traveling on a budget.,"['singapore', 'singaporeeats', 'singaporefoodie', 'traveleats', 'traveltok']",10.8K,8137,1092,70,cheap eats in Singapore if you're on a budget Nam Kee pau scissor cut curry rice Lau Pa Sat Satay 78 chicken satay Nineteen Kitchen minced meat noodles Sushi Express Sushi
225_post,https://www.tiktok.com/@malissiasiri/video/7163880290698480898,Malissia Sirica,95,178.9K,2M,2022-11-9,/@malissiasiri,malissiasiri,Positive affirmation ! 🤍❤️🇸🇬,"['singlish', 'singapore', 'slang', 'travel']",4734,320,51,87,"one thing about moving to singapore Start using can way too
often"
226_post,https://www.tiktok.com/@emceeanandk/video/7199074306633043206,emceeanandk 🧿,622,1101,18.5K,2023-2-12,/@emceeanandk,emceeanandk,Maha Kumbabishegam 2023!,"['kumbabishegam', 'mariamman', 'amman', 'singapore', 'beautiful', 'southbridgemariammantemple', 'culture', 'indianculture', 'positivevibes', 'videography', 'travel', 'viralindian', 'festival', 'trendingtiktokviral', 'trending', 'fyp', 'fyppage', 'hindu']",1958,70,279,18,
227_post,https://www.tiktok.com/@erika.dwyer/video/7082687623805865217,Erika Dwyer,122,270.3K,9.8M,2022-4-4,/@erika.dwyer,erika.dwyer,Singapore was a magical place 🇸🇬✨🌿🏙,"['singapore', 'singaporetiktok', 'travel', 'vlog', 'aestheticvlog', 'travelvlog']",3639,569,238,63,come to singapore with me
228_post,https://www.tiktok.com/@theycallmegenny/video/7220799667179638024,Theycallmegenny,430,9825,428.7K,2023-4-11,/@theycallmegenny,theycallmegenny,The bed though…. I rly knocked out. 💤,"['singaporeairlines', 'businessclass', 'gemswithgentravels', 'traveltok', 'tiktoksg', 'fypsg']",610,29,42,8,champagne and I just realized that I can charge my damn phone battery so I was really happy and then I went on to watch a movie and I'll see the living room is the best part because they also provide like that and I also really love to travel kit that they provide service my favorite is the faceless I can hydrate I had to use flashy take this video because it's really really dark my time
229_post,https://www.tiktok.com/@luchredbatoctoy/video/7223437795405090054,Luch,239,651,11.9K,2023-4-18,/@luchredbatoctoy,luchredbatoctoy,3 Tips when traveling to Singapore,"['traveltosingapore', 'travelingtips', 'singapore']",62,40,14,20,hey guys I want to share this step before you go to Singapore I'm sharing this my experience so it wouldn't happen to you so the first step is that always get the easy card and load them before you explore their transport system because once you're right in their bus and you give the money the fair they don't give change just have to drop it in the box and there's no change but it's like giving extra money to the government next is when you cross the border to Malaysia and go to Legoland do not do it on a weekend because there will be a lot of people in line and it will take hours and hours before you can cross the border it's a waste of time instead of you enjoying and walking arounddo Malaysia last step but not the least so when you explore jewelry in Changi Airport do not go to the immigration and check in yet cuz if you do that you can't go out to the mall anymore because you already crossed the immigration and it's considered a neutral ground or something and the mall is a public mall which is still part of Singapore so when you cross the immigration it's like you are crossing the border going to your country now so you can't do it like go back to Singapore and explore Google so that that happened to us the last of that of our trip was to explore Jewel andTerminal 4 and you can go to Jewel by going to I remember Terminal 3 my writing a train so we go there and then when I was about to go to the mall the airport personal stop me she said you can't do that because you already crossed the immigration so yeah it's a bummer we did not forget you so if you want to go to Singapore get the card right away if you want to use their transport system do not give cash or change because there will be no change for you next is when you cross the Malaysian border do not do it on a weekend when you come to Singapore and if you want to explore Chinese before going back to the Philippines do not go to the immigration or check in thank you so much for watching Ihope this video helps you guys and enjoy traveling to Singapore
230_post,https://www.tiktok.com/@andsheblooms/video/7166957052961623322,Shifa’s Journey ✈️🌎,42,54.2K,1M,2022-11-17,/@andsheblooms,andsheblooms,Replying to,"['traveltiktok', 'singaporetravel', 'traveling', 'singaporetrip', 'singaporemrt']",2731,2929,325,55,travel guide SINGAPORE app CityMapper Marina Bay Sands Singapore Universal Studios Singapore Lavender MRT Station ION Orchard Gardens by the Bay Changi Airport Terminal 2
233_post,https://www.tiktok.com/@kimsenara/video/7213697760321654022,kimsenara on ig,25,55.4K,3.3M,2023-3-23,/@kimsenara,kimsenara,"Singapore Travel 2023 🇸🇬 DIY Edition! This is our singaprore Itenirary with tips & guides! Budget, Hotels, and Attractions! ♥️ We also went to malaysia from singapore via Bus only & thats also another passport stamp! Watch to know how 🙈 ","['singapore', 'singaporetravel', 'universalstudiossingapore', 'singapore2023', 'fyp', 'fy', 'fypシviral', 'traveltiktok']",3246,1817,509,77,if you are planning to go on a diy trip to singapore then this video is this is everything we did on our trip to singapore and i am going be sharing it with you guys. so for easier diy tour you will be needing agoda and booking.com super important is prepare your sg arrival card before departure so we booked our flight through agoda it is almost a four hour flight from manila to singapore my free shuttle bus from jewel stroller and free shuttle. we are going to be staying in singapore a couple days more we booked hotel through booking.com hotel is very solid. make sure to get a mrt  map from the airport for hassle free transportation tourist pass plus card sim card unlimited data. we also went to universal studios you can book  ticket through klook mrt or bus. gardens by the bay skywalk my fear of heights could never light show. i suggest you go fair price it is everywhere self check out. 
235_post,https://www.tiktok.com/@shuutravels/video/7252707102269934856,shu 🌻,328,44.3K,2.2M,1w ago,/@shuutravels,shuutravels,Can you believe this is in Indonesia?! Save Loccal Hotel in Labuan Bajo to your bucket list 🌊 Footage captured using the Canon EOS R50 camera — it’s small and travel-friendly yet really packs a punch in terms of its versatility!,"['vlogwithr50', 'eosr50', 'canon', 'canonsg', 'canonsingapore', 'sgtravel', 'labuanbajo', 'summer']",1075,335,92,6,
236_post,https://www.tiktok.com/@chloekane21/video/7205155137130695942,Chloekane21,72,274,7888,2023-2-28,/@chloekane21,chloekane21,Some of the endless things to do in Singapore 🇸🇬,"['singapore', 'travel', 'foryou', 'fyp', 'tiktok', 'gardensbythebay', 'avatartheexperience', 'marinabaysands', 'highlights', 'fun', 'activities']",1534,894,197,6,"7 things to do in singapore see marina bay sands, visit the artscience museeum walk down arab street watch the light show at gardens by the bay. visit sea aquarium, go on a night safari. visit avatar the experience"
237_post,https://www.tiktok.com/@nickandhelmi/video/7125005894445780226,Nick & Helmi | Travel & Food,174,111.4K,5.2M,2022-7-27,/@nickandhelmi,nickandhelmi,5 Things to know BEFORE travelling to Singapore🇸🇬 Share to anyone who is planning to visit Singapore✈️,"['singapore', 'travelsingapore', 'travelvlog', 'travelvlogger', 'travelguide', 'traveltips', 'thingstoknow', 'sg', 'singaporetiktok', 'australia']",2112,1163,266,13,this is five things to know before coming down to Singapore one you don't need to do PCR test before your flight however you need to be fully vaccinated to enter to you need to complete a Singapore arrival Card 3 days before your arrival visa on arrival from Australia and most major countries there's a tourist SIM card which you can buy from click one of the cheapest way to get connected link on bio few ways to get to the city caps MRT or passenger service apps like grab which I recommend you downloading it's super convenient and welcome to Singapore
238_post,https://www.tiktok.com/@rdwerehere/video/7188925001947417882,RDwerehere,173,72,674,2023-1-15,/@rdwerehere,rdwerehere,Top 3 FREE things to do in Singapore this 2023!,"['thingstodosingapore', 'travelsingapore', 'pinoytraveller', 'freetravel', 'fyp', 'foryourpage', 'travel2023']",505,141,36,10,3 free things to do in singapore this 2023. explore the jewel at changi airport. watch the gardens by the bay light show. take a picture outside universal studios. follow for more travel tips
239_post,https://www.tiktok.com/@travelguyss/video/7246102578000366875,Travel Guys 🌎,70,739.9K,18.3M,2023-6-18,/@travelguyss,travelguyss,Most beautiful places in Singapore ✨🤩,"['adventure', 'explore', 'travel', 'traveltiktok', 'travellife', 'bucketlist', 'views', 'destination', 'singapore', 'singaporetiktok', 'singapore🇸🇬', '🇸🇬', 'asia']",90.7K,12.1K,3758,2205,"places on earth that dont feel real singapore garden by the bay. marina bay, sentosa beach"
240_post,https://www.tiktok.com/@daddy.xj/video/7245656990549085448,daddy.xj,408,8898,130.2K,2023-6-17,/@daddy.xj,daddy.xj,3 things you wish to know before you go to China🇨🇳,"['travelchina', 'traveltips', 'travelhacks', 'traveltok', 'tiktoksg', 'sgfyp', 'singaporeairlines']",1569,400,427,61,three things you wish to know before you go to China is very important to bring some cash and debit card as backup in case I leave here and WeChat pay do not work during my trip in China I was locked from alipay and WeChat pay and had to use cash for the remaining of my trip luckily I could still withdraw cash with my debit card at most ATMs also International credit cards are not accepted the most establishment in China except for places like hotels from large Brands you cannot get a Chinese SIM card when you are in China unless you have a Chinese passport before you go remember to get the data seen or portable Wi-Fi device I got mine from travel Wi-Fi lastly almost every weekend
241_post,https://www.tiktok.com/@_mydearjunnie/video/7233426507803184390,mydearjunnie on fb,43,1705,68.5K,2023-5-15,/@_mydearjunnie,_mydearjunnie,Replying to,"['aerolinebus', 'aerolinebusmalaysia', 'travelsingapore', 'travelmalaysia', 'travelwithparents', 'travel', 'traveltiktok']",5981,2778,1046,273,"let's go travel from Singapore to Malaysia via Airline pass 6:45 p.m. on 3 9 9a.m. 4:30 p.m. and 6:45 p.m. 6:45 p.m. today look at how comfortable and spacious the seats are I paid 50 SGD for one way ticket going to Malaysia but I got a discount so almost 2,000 each time bringing a food is allowed inside the bus and they also provided free water on board my socket for charging and more space and legroom you can also adjust the seat if you want to reply or extensive feet area my USB charging before leaving the staff check first is complete passengers at 6:44 p.m. we're already moving blankets on board gameset alarm for those who want to listen to music or watch a movie I decided to listen to music period this is going to the departure home in Singapore and look at other passengersimmigration also in some cases My Mama lyricsrestart restart episodeso here's me enjoying my comfortable traveling Business Class Bus experience few minutes after dinner stuff to ask us I know your heart rate so my optionswatching it for the first time so the second movie collects all the trash so baby can you and your mama plastic cups 1205 a.m. almost 6 hours 5 hours to 6 hours of traveling on a Friday night thank you for joining us in our Singapore to Malaysia Boston thank you for watching"
242_post,https://www.tiktok.com/@mulia_setyowati/video/7199877899707600154,Mulia Setyowati Tias,130,74.7K,1.1M,2023-2-14,/@mulia_setyowati,mulia_setyowati,"Colokan kaki 3 penting bgt sih, walau kadang di hotel ada 1-2 colokan yg gaperlu kaki 3 ","['travellife', 'traveltips', 'travelsingapore', 'travelsingapore2023', 'tipsliburan']",15K,9555,1664,163,"tell me about Singapore sg arrival card, sim card cheers. transport mrt bus. powerbank charger"
243_post,https://www.tiktok.com/@laurentiataniaa/video/7189641194387836186,Tania Maureen,37,106,3816,2023-1-17,/@laurentiataniaa,laurentiataniaa,SINGAPORE 3 days itinerary⬇️,"['singaporeguide', 'singaporetrip', 'singaporetravel', 'visitsingapore', 'visitsg', 'southeastasiatravel', 'southeastasiatrip', 'wisatasingapore', 'jalanjalansingapore', 'singaporespot', 'singaporedestination', 'instatraveller', 'femaletravel', 'femmetravel', 'singaporeinsiders', 'travelbible', 'travelgram', 'travelsoutheastasia']",2288,1693,176,14,"singapore 3 day itenerary details on caption

"
244_post,https://www.tiktok.com/@nessiemess/video/7251836924283915522,ness,236,16.5K,968.5K,2023-7-4,/@nessiemess,nessiemess,manifesting those Eras Tours tickets - Klook is selling tickets with attractive Klook bundles exclusively on their app!! Indicate your interest at https://www.klook.com/tetris/promo/taylorswifttheerastoursg/ for more updates on this deal ✨✨✨,"['theerastourwithklook', 'klookkreator', 'taylorswift', 'erastour', 'erastoursg', 'nationalstadium', 'klooksg', 'singapore']",9202,1218,1274,173,if you're looking to get Taylor Swift that you rest to us tickets in Singapore just like me but you saw that over 22 million people pre-registered for the general sale and you don't have a UOB card this is another way in which you can get your ticket selling the tickets on the app with attractive cook bundles including must stay hotels this is perfect for Swifty's in Southeast Asia looking to come to Singapore and if you're Singapore and you can go for acoustic station the tickets for the same as the general sales it's exclusively done by the app so please download their app and indicate your interest in the link I love Taylor Swift so much I grew up with her I love all heroes manifesting those tickets
245_post,https://www.tiktok.com/@jyyyntot/video/7221172462334070021,The Millennial Gastadora,388,731,34.1K,2023-4-12,/@jyyyntot,jyyyntot,Wish I could have the chance to live here,"['fyp', 'foryou', 'foryourpage', 'fypageシ', 'foryoupage', 'foryoupagе', 'singapore', 'traveltok', 'sgtiktok', 'sg', 'singaporetiktok', 'traveltiktok', 'travel2023', 'traveltipssingapore', 'travelguidesingapore', 'minivlog', 'minivlogs', 'tipsandhacks']",9692,3877,1168,107,"useful things to know before visiting singapore part 1, 1 wear light clothings sg is a hot and humid country like ph wear breathable and lightweight clothing. always wear sunscreen you will gonna be exposed to a lot of sunlight so make sure to apply sunscreen every 4 hours. bring refillable water bottle if you are on a budget, this is a must since drinks and food are expensive in sg there are a lot of water drinking fountains all over sg where you can fill up your bottle bonus tip tap water in sg is safe to drink. use public transportation. sg transportation system is amazing and very efficient. especially the mrt it will take you everywhere you want to go in a whim plus cost per ride is very cheap. bring tissue or hanky. sg is known to be a green city. you will rarely encounter food joints and restaurants providing tissue for diners. best to buy a pack of tissue or hanky. like and follow for part 2"
246_post,https://www.tiktok.com/@sarahcatonn/video/7183954315973774598,Sarah Caton,257,7536,162.6K,2023-1-2,/@sarahcatonn,sarahcatonn,"What we spent in Singapore, only a short visit but we loved this amazing city!!🧡🌟 ","['singapore', 'travel', 'budgettravel', 'fyp', 'backpacking', 'asia', 'backpackingasia', 'traveltips', 'travelbudget', 'traveltok']",1196,301,41,12,how much we spent for 5 days in singapore. accomodation 271 transport 12 activities 57 food 240 amazing sightseeing free
247_post,https://www.tiktok.com/@beanlately/video/7200027825502571803,bea,765,8551,336.5K,2023-2-14,/@beanlately,beanlately,Day 3 in Singapore itinerary:,"['fyp', 'travel', 'singaporetiktok', 'traveltiktok', 'tiktokfinds', 'finds', 'recommendations', 'singapore', 'travellife', 'tips']",274,185,72,7,day 3 in singapore
248_post,https://www.tiktok.com/@jordentually/video/7178122313274100994,Jorden Tually,493,3.5M,132.2M,2022-12-17,/@jordentually,jordentually,Replying to,"['whatheck', 'travel', 'flying', 'mexico', 'usa', 'japan', 'singapore', 'australia', 'asia']",205.5K,9053,212,3470,can you travel to the opposite side of the earth that would be very painful but let's do it I'm currently in Cancun Mexico and I just realized that it's going to be a long haul not to mention an expensive one let the journey beginners I went straight to the airport here we go again I wake up early and I was still cutting it close to missing my first flight after almost falling asleep multiple times I was on my way to Dallas one was 13 hours long to Tokyo the views were incredible but the food was not and just like that I landed in Japan but not for long because I had one more flight to my destination which is Singapore hours and after 30 minutes
249_post,https://www.tiktok.com/@kegs97/video/7158161907885559046,KEGS,667,161K,6.7M,2022-10-24,/@kegs97,kegs97,This is your sign to go on a solo trip x,"['singapore', 'travel', 'solotravel', 'vlog']",2262,67,15,35,i have no friends mini vlog went around so fucking fun by yourself so i went to universal studios to start off the day and i get to skip every single queue full on because i was by myself if you ever bring me to on a date theme park because i am in my element. went to the light show which was so fucking cool by the way
250_post,https://www.tiktok.com/@pommyks/video/7100180293239180570,Pom,192,2145,50.8K,2022-5-21,/@pommyks,pommyks,Singapore trip 2022 🇸🇬,"['singapore', 'traveltiktok', 'vlog', 'สิงคโปร์', 'สิงคโปร์2022']",2009,722,700,30,singapore
251_post,https://www.tiktok.com/@followtheyellowflag/video/7138632561206611227,Follow the Yellow Flag,330,6373,58.4K,2022-9-2,/@followtheyellowflag,followtheyellowflag,"A must-see place in Singapore! Perfect for family, friends, or even for dates! 💙 Follow for part 3! ","['singapore', 'travel', 'traveltiktok', 'traveltok', 'ecozonetravelandtours']",3412,1561,449,20,places to visit in singapore part 2 art science museum future world
252_post,https://www.tiktok.com/@lifeofchelo/video/7239639203091320069,itschelo 😚 | travel & life,43,12.2K,265.8K,2023-6-1,/@lifeofchelo,lifeofchelo,more travel tips coming soon kaya dont forget to follow 😊,"['travelvlog', 'traveltiktok', 'travelph', 'traveltips']",3798,2232,596,117,"Travel to Singapore Requirements as of June 2023 Etravel for PH immigration Announcement You may only register within 72 hours prior to your arrival or departure in the Philippines Travelers are enjoined to present PHILIPPINE PASSPORT FOREIGN PASSPORT HOLDER HOLDER Hotel Booking Return Flight Travel Insurance Proof of employment proof of ties in PH Note  vaccine card but not sure if its a common practice CLASSIC FILIPINO BREAKFAST FULL AMERICAN BREAKFAST Bacon Egg ond your choice of 470 waffles or pancakes In SG automated immigration na No need interview Scan your passport Follow for more travel tips content 

"
253_post,https://www.tiktok.com/@maddiemareejames/video/7235980148334447874,Mads,98,227,3675,2023-5-22,/@maddiemareejames,maddiemareejames,7 MUST DO THINGS IN SINGAPORE 🇮🇩,"['travel', 'singapore', 'travelsingapore', 'gardensbythebay', 'singaporetiktok', 'southeastasia', 'fyp', 'holiday', 'travellingsoutheastasia', 'tiktok', 'trending']",216,51,7,1,"7 things to do in singapore, gardens by the bay, universal studios, cloud forest avatar the experience, jewel changi airport, mandai night safari, sea aquarium sentosa art science museum"
254_post,https://www.tiktok.com/@angusvsdonuts/video/7252999728772779265,Angus Tan,65,27.5K,1.4M,6d ago,/@angusvsdonuts,angusvsdonuts,"📍overeat 5 Straits View, ","['02', 'cheapeats', 'buffet', 'sgeats', 'budgeteats', 'cheaptravels', 'cheaptravel', 'foodie', 'cheapeats']",2017,272,100,8,and of course some pasta I didn't forget about dessert as well thankfully I can still cover it up now let's see if it takes any good all right honestly quality of food was amazing and nothing special I mean it's like a standard Buffet level four is definitely worth the money because I was so damn full after that
