id,url,account_name,following_count,follower_count,total_like_count,date,href,handle,description,hashtag,like_count,bookmark_count,share_count,comment_count,final_text
0_post,https://www.tiktok.com/@montanadarby/video/7232388092764671258,Montana | Travels,149,95.5K,4.8M,2023-5-12,/@montanadarby,montanadarby,The perfect 48 hour itinerary for Singapore!,"['singapore', 'singaporetravel', 'travel']",36.7K,25K,5008,208,"How to spend the perfect 48 hours in Singapore? First, head to your waterfall at Singapore airport, it's absolutely incredible and not to be missed. Then, head to the center and drop by the Future World Exhibition at the Art Science Museum. Next, you have to head to Gardens by the Bay, it's completely free to walk around here and just look how amazing it is. Don't forget to buy tickets for the Skyway for the most insane views of the Floral Fantasy, for a magical indoor garden escape. And of course, you have to catch one of the free light shows. Start early to head to one of the most iconic photo spots in Singapore, the Fort Canning tunnel. Then it's time for a quick stroll along Arab Street for the most incredible foods of Sultan mosque before stopping by Crack."
1_post,https://www.tiktok.com/@trippingmillennial/video/7194849267461426478,Travel with Rachael ✈️,474,57.1K,1.8M,2023-1-31,/@trippingmillennial,trippingmillennial,Hawker centers are my love language,"['southeastasia', 'singapore', 'travelsingapore']",4913,3686,806,31,"Skip to Singapore, kind of feels like a trip into the future, and if you visit, here are five can't-miss things that you should do. First, Singapore is pricey, but thankfully, the Hawker centres are not. These food halls are a great way to sample some of Singapore's Best Foods; it's really cheap; some of them are Michelin-starred, and it's a good way to get to the local culture. To using the incredible Gardens by the bay. While most of this area is actually free to explore, I recommend springing for tickets to the Skywalk along with the cloud forest and the beautiful Flower Dome. Don't miss the night show here either (more on that later). Period which is a beautiful, quirky, colorful, fun place to explore, even when it's raining; it's a good place to shop and get a beer and people watched. The trip to the iconic Marina Bay Sands Hotel; definitely don't skip on the historic Raffles hotel, which is a beautiful example of British colonial architecture, and don't miss their Long Bar, which is famous for the Singapore Sling cocktail. Thanks and follow for More Travel content."
2_post,https://www.tiktok.com/@montanadarby/video/7217039897687887109,Montana | Travels,149,95.5K,4.8M,2023-4-1,/@montanadarby,montanadarby,The ultimate guide on the BEST things to do Singapore! Can you believe most of these things are completely FREE!!,"['singapore', 'singaporethingstodo', 'marinabaysands', 'jewelchangi', 'gardensbythebay', 'backpacking']",73.7K,40.3K,10.5K,609,Sky Garden at Capita Spring free. Jewel fountain at Changi Airport free. OCBC Skyway £7.30. fort canning walk / tunnel free. arab street free. Gardens by the bay light show free. level 33 rooftop bar free entry. floral fantasy exhibition £9.10. spectra light show free. future world at art science museum £9.20.
3_post,https://www.tiktok.com/@aktravelss/video/7208911518451223813,AKTRAVELS ✈️ 🌍,129,130.2K,8.4M,2023-3-10,/@aktravelss,aktravelss,Singapore is just different 🇸🇬,"['singapore', 'singaporetiktok', 'singaporelife', 'shopping', 'traveltiktok', 'aktravels']",2.1M,292.8K,25.1K,11.7K,"shopping in singapore, LOUIS VUITTON "
4_post,https://www.tiktok.com/@belemartorres2/video/7218172665222237441,Belemar Torres,440,1284,37.2K,2023-4-4,/@belemartorres2,belemartorres2,Here’s my top 20 most visited place in Singapore!,"['singapore2023', 'travelsingapore', 'solotraveling', 'fyp']",10.1K,7756,1935,71,"top 20 places to visit, merlion park, marina bay sands fountain show, skypark / celavi, helix bridge, gardens by the bay, haji lane, bali lane, sultan mosque, chinatown, little india, arab street, orchard, raffles hotel, sentosa sea aquarium, universal studios, cable car, fort canning tree tunnel, jewel changi airport"
5_post,https://www.tiktok.com/@montanadarby/video/7232762179869560090,Montana | Travels,149,95.5K,4.8M,2023-5-13,/@montanadarby,montanadarby,Singapore - What I spend in a day! Unpopular opinion but I really didn’t think it was that expensive at all! So many free or reasonably priced things to do here!,"['singapore', 'singaporetravel', 'travel']",7917,2938,511,133,this is really one of the most expensive cities in the world let's find out his wife spending a day in Singapore jumped on the MRT which is about 90 per journey and it's really easy to use just tap your contact list card. headed straight to Fort Canning tunnel because tiktok made me do it and it's completely free to do this. then I went to Arab street because I wanted to see the sultan mosque which is absolutely gorgeous by the way. then I went to Chinatown for lunch and I went to Artistic and you can choose your own barbecue skewers and all of this and a drink was only eight pound 32 so far I think that's pretty good. then I went to the sky Garden at Capitol Spring and most underrated thing to do in Singapore put away is completely free to do it and it's got the most incredible views of the bay. then I went to level 33 rooftop bar for Sunset rings and yeah drinks are more expensive here but not like crazy expensive I got hard Seltzer for seven pounds. then I went to a hawker Center which I'd heard was pretty cheap for food and I got these vegetables for only four pounds 80. this is inside the shopping center which is literally amazing and they've even got a sparkly Louis Vuitton as well. it's time to head to the Spectra light show which is also free so many free things to do in Singapore which is great. then it ended the night with some ice cream which is 5 pounds 40
6_post,https://www.tiktok.com/@klook.my/video/7244541203247680770,Klook MY 🇲🇾,13,58.1K,1.6M,2023-6-14,/@klook.my,klook.my,These spots are great for photos too! 📸,"['singapore', 'freeplaces', 'klookmy', 'klooktravel', 'thingstodo', 'placestovisit', 'cheapplaces', 'traveltips', 'singaporetips']",8474,6094,846,43,"Its too expensive to visit Singapore now. Here are 6 FREE places visit in Singapore, Jewel Changi Airport, Southern Ridges. Supertree Grove entrance free. ocbc skyway rm42. Singapore Botanic Gardens Entrance free, national orchid garden rm52. macritchie treetop walk free."
7_post,https://www.tiktok.com/@lgdm0213/video/7205540561774857499,Lou DM,125,653,25.6K,2023-3-1,/@lgdm0213,lgdm0213,Our 6D5N DIY Singapore Itinerary + our Total Expense. 😊,"['singapore', 'singapore2023', 'singaporetravel', 'singaporetrip', 'travel2023', 'singaporeitinerary', 'sgitinerary', 'singaporetrip2023', 'itinerarysingapore']",8271,5893,1854,263,"Our DIY Singapore Trip Daily Itinerary for 6 Days and 5 Nights, Total Expense at the end of the video. Jewel Changi. Arrival in Singapore. Dinner in Orchard Road, Brunch in Chinatown, Gardens by the Bay, Cloud Forest Flower Dome, Supertree Grove, sightseeing shopping, haji lane, arab street, Little India, Bugis Street, Newton Hawker Centre, Brunch at Vivo City, Universal Studios Singapore, Fun Day. Brunch and shopping in Chinatown, Merlion Park, Art Science museum, Shoppes at Marina Bay, breakfast, shopping in Don Don Donki, Checkout, Flying back to Manila, Total Expense, for 2 persons"
8_post,https://www.tiktok.com/@aleevpizarro/video/7192545572161670427,Alyssa Villarama Pizarro,711,49K,389.3K,2023-1-25,/@aleevpizarro,aleevpizarro,Where to go for your Singapore travel? Save this for future purposes!😉,"['singapore', 'placestovisit', 'travelsingapore', 'travelideas', 'travelhack', 'fyp']",9606,4872,1600,113,"Places to visit in Singapore, changi airport, universal studios, merlion, marina bay sands, supertree grove, Art Science Museum, helix bridge, kampong glam, haji lane, old hill street, gardens by the bay, cloud forest, Songfa Bak Kut Teh, Little India."
9_post,https://www.tiktok.com/@visit/video/7211292968530103557,Visit,50,7.1M,134.7M,2023-3-16,/@visit,visit,Marina Bay Sands Hotel is one of the most unique sights in Singapore 🇸🇬 🎥 @ibbz_7 📍Singapore,"['uniquestays', 'hotelstays', 'marinabaysands', 'singaporetok', 'visitsingapore']",120K,9279,6406,802,Singapore
10_post,https://www.tiktok.com/@elitevacays/video/7215048588953439493,ELITE VACAYS,0,354.5K,11.6M,2023-3-27,/@elitevacays,elitevacays,Who are you bringing? Check out the link in our bio for a travel must-have✨,"['amazinghotels', 'travelproducts', 'travelworld_addict', 'traveltok']",5940,1311,184,23,"must see hotels that will leave you speechless, Marina Bay Sands Singapore"
11_post,https://www.tiktok.com/@aktravelss/video/7201129793759284486,AKTRAVELS ✈️ 🌍,129,130.2K,8.4M,2023-2-17,/@aktravelss,aktravelss,PLACES TO VISIT IN SINGAPORE PART 1 🇸🇬,"['singapore', 'travel', 'aktravels', 'jewelchangi', 'merlionpark', 'gardensbythebay']",54.8K,14.6K,1842,179,"places to visit in Singapore, jewel changi airport, merlion park, Gardens by the bay, arab street, universal studios, "
12_post,https://www.tiktok.com/@pocketsofsunshines/video/7231887306091760898,Pocketsofsunshines 🌼,4144,1447,50.1K,2023-5-11,/@pocketsofsunshines,pocketsofsunshines,"Part 1 | When in Singapore, dont forget to explore the streets of Joo Chiat ✨ ","['exploresingapore', 'travelsingapore', 'cafehoppingsg', 'sgfoodie', 'whattodoinsg', 'dateideassg', 'wheretogosg', 'joochiat', 'cafesg', 'mysgguide']",20.2K,13.7K,1435,72,"when you are in singapore do not forget to visit joo chiat, peranakan house, cafes from coffee to ice cream, quirky indie store"
13_post,https://www.tiktok.com/@drewhacks/video/7197767840303172906,DrewHacks,137,2.5M,135.2M,2023-2-8,/@drewhacks,drewhacks,Is this the World's Best Airport?,"['singapore', 'travel']",717.4K,62.5K,4454,2977,changi airport is the world's most luxurious airport. actually that nice it has the world's largest indoor waterfall in the forest with a magical maze. there's also a technology area with a mirror illusion room and a gym that has workout video games with a massive screen. I've never seen an airport like this before that even has a vending machine that sells gold bars a gold bar the size of a fingernail I can't believe I just bought that. if you want to run around before your flight you can jump on the slide or the trampoline course. or watch a movie in the IMAX movie theater called completely transforms for the Disney light show
14_post,https://www.tiktok.com/@paulivandg/video/7241556477113060614,Ivan de Guzman,746,1.8M,28.1M,2023-6-6,/@paulivandg,paulivandg,Universal Studios Singapore • Travel Tipid Tips,"['travelph', 'traveltiktok', 'traveltok', 'traveltips', 'learnontiktok', 'paulivandg']",5761,2565,771,85,Universal Studios Singapore number one is coming at 11:00 a.m. opening the part number to bring a bottle and mineral .Waters Park number to bring a wrinkle number for Papa Murphy's Pizza coupons
15_post,https://www.tiktok.com/@nuncyyyy/video/7196107729218309403,Nuncyyyyy,142,10.8K,2M,2023-2-4,/@nuncyyyy,nuncyyyy,✈️🇸🇬🥰,"['singapore', 'universalstudiosingapore', 'travel']",2M,152.7K,24.6K,3883,
16_post,https://www.tiktok.com/@itstravelchan/video/7220603906957708550,itstravelchan,7,1118,9550,2023-4-11,/@itstravelchan,itstravelchan,Singapore at night!,"['travel', 'travelvlog', 'traveltiktok', 'sg', 'singapore', 'asia', 'adventure', 'explore', 'nightvibes', 'nightcityview', 'city', 'shorts', 'short', 'foryou']",7368,1154,681,42,riverside point
17_post,https://www.tiktok.com/@daddy.xj/video/7246753475168570632,daddy.xj,408,8896,130.2K,2023-6-20,/@daddy.xj,daddy.xj,Do you know you can redeem paid attractions and experiences in Singapore for free for yourself and/or your family and friends entering Singapore? 👀,"['travelsingapore', 'travelsingapore', 'exploresingapore', 'freethingstodo', 'fypsg', 'tiktoksingapore']",985,635,155,20,free things you can do in Singapore if you meet these three conditions you cannot enjoy pay attention in Singapore such as a zoo and Sea Aquarium or even eat and drink for free. first you need to be a Singapore tourist second you must enter Singapore via flight as you will need to verify your arrival in Singapore to receive the ticket that you must read him Singapore rewards for the first time if you meet all these requirements you can go to visit Singapore Dot.
18_post,https://www.tiktok.com/@ramalauw/video/7178544217814224134,Rama,291,593.8K,33.7M,2022-12-18,/@ramalauw,ramalauw,This country just called me ✨poor✨ in all its 4 national languages 🥰,"['singapore', 'traveling', 'amipoor', 'travel']",17.8K,2274,756,183,head to the famous Marina Bay Sands Hotel this hotel has an amazing infinity pool where you're guaranteed the best view of Singapore the entrance is like super expensive so what you can do is just stand in front of the building and watch the rich people live the life of your dreams. Singapore also has a lot of cute coffee shops but even as simple as coffee with cautious
19_post,https://www.tiktok.com/@montanadarby/video/7232004733987343643,Montana | Travels,149,95.5K,4.8M,2023-5-11,/@montanadarby,montanadarby,Felt like I was in an Avatar movie!!,"['travel', 'singapore', 'singaporetravel', 'gardensbythebay']",2100,665,240,15,this is Gardens by the bay and without a doubt this is one of the best things you can do while you're in Singapore the best part the gardens are completely free to enter and there's a free daily light show at 7:45 and 8:45 p.m. also I decided to get a ticket to the Skyway which runs through the gardens by the Bay tickets were only 7 lb and it's the most incredible View
20_post,https://www.tiktok.com/@odikabayu/video/7236331628782439685,Odika Bayu,131,50.9K,3M,2023-5-23,/@odikabayu,odikabayu,Places that are must-to-visit in Singapore!! Save now for your next trip to Singapore 😍,"['singapore', 'travel', 'viralditiktok', 'tiktoktraveltrend', 'minivlogtravelling', 'vlogjalanjalan', 'traveltiktok', 'tour', 'travelingvlog', 'jalanjalantraveling']",18.5K,12.6K,1885,143,"places to visit in Singapore, jewel changi, marina Bay, Fort Canning Tree Tunnel, ion orchard, marina barrage, art science museum, sultan mosque, Old Hill Street Police Station, haji lane, Helix Bridge, library orchard, alkaff bridge"
21_post,https://www.tiktok.com/@nathaniaclr/video/7246699681328286982,Nathania Clairine,151,5306,480.2K,2023-6-20,/@nathaniaclr,nathaniaclr,u should put “trip to SG with ur bestie” in your bucket list!!,"['singapore', 'travel', 'bestie']",86.4K,10.4K,2676,1901,"once in a lifetime, you should go to sg with your bestie."
22_post,https://www.tiktok.com/@swizzyinsg/video/7242919229945548033,Mary,47,4670,115.3K,2023-6-10,/@swizzyinsg,swizzyinsg,‼️Only 30’ away from Singapore you find this hidden paradise🏝️,"['lazarus', 'lazarusisland', 'singaporeisland', 'exploresingapore', 'singaporetravel', 'discoversingapore', 'thingstodoinsingapore']",4022,1066,1222,139,"only 30 minutes from Singapore you find a Hidden Paradise called Lazarus, take the ferry from Marina South Pier which is only $15 and a bit windy but you discovered this beautiful white sand and clear blue water the island is so much bigger than expected and there is a unique container hotel for $160 per night. if you want to stay a little longer make sure to leave the beach on time before the rain comes and Singapore disappears in the storm"
23_post,https://www.tiktok.com/@kerrynlee/video/7254541390720339207,小欣 Kerryn Lee,298,28.2K,1M,2d ago,/@kerrynlee,kerrynlee,How to get free vouchers from Jewel Changi Airport🤑,"['singapore', 'tiktoksg', 'fyp', 'jewel', 'changiairport', 'sgfoodie', 'visitsg', 'sgtravel', 'singaporeairlines']",11.5K,6690,1760,26,if you're traveling out from Singapore and you're flying one of these Airlines do you know that you can get these vouchers if you do your early check-in at level 1 Jewel all you need to do is be here by 3 hours or earlier before your flight do your usual check-in and you can get this vouchers from the stuff if you are a tourist you can go to the concert at level two show your passport and you can get another voucher for you to shop at Jewel follow me for more exciting deals in Singapore and I'll see you in my next video bye-bye
24_post,https://www.tiktok.com/@ilupbeach/video/7078516671564041473,Ilupbeach,227,1736,25.7K,2022-3-24,/@ilupbeach,ilupbeach,,[],21K,2175,1981,303,"hidden place in singapore, Sea Scent at Keppel Club"
25_post,https://www.tiktok.com/@deeniseglitz/video/7237785697799671042,Deenise Glitz,74,84.1K,5.7M,2023-5-27,/@deeniseglitz,deeniseglitz,Stuck in Singapore during June hols? I gotchu. Most of the museums here are free for locals.,"['exploresg', 'placestogo', 'wheretogo', 'singapore', 'travel', 'tiktoksg', 'museums']",15K,5922,2563,33,"free things to do in June part 1, national museum of singapore, peranakan museum, singapore art museum, 10mins walk from Dhoby Ghaut MRT, Tip You can walk over to this spot after visiting National Museum of singapore, Tip You can explore the private art galleries there too

"
26_post,https://www.tiktok.com/@daddy.xj/video/7234456107534585096,daddy.xj,408,8896,130.2K,2023-5-18,/@daddy.xj,daddy.xj,✨[SAVE THIS AND TRAVEL LATER]✨,"['sgtravel', 'traveltips', 'singaporetravel', 'changiairport', 'traveltiktok', 'sgtiktok', 'fypsg']",11.5K,6431,1595,87,free things to do in Singapore Changi Airport Terminal 4 and I will be sharing three things you can do this time number one experience the truth of sliding down these giant slide for free and then bounce and climb in this network play structure that is 60 M tall the giant slide is seriously fun and I could not resist playing it multiple times before I bought my plane. number two head to the Heritage Zone where you can relax on a comfortable so far and enjoy this mesmerizing 6 minutes musical show on the giant screen it makes you feel as though you are in a concert or so what about the meaning for and appreciate the amazing world like this Bloom centerpiece which is perfect for photography and selfies. number three take a shot at this Lounge for free I am 1.86 meters tall and I can't really sleep well on this comfortable seats which have soft hit rest not free but other things you can do in terminal 4 in clothes getting a tiger beer before you fly to check out the amazing and retail stores in terminal for there's so much to explore.
27_post,https://www.tiktok.com/@visit_singapore/video/7207742216847068424,Visit Singapore,22,1.5M,8.1M,2023-3-7,/@visit_singapore,visit_singapore,Growing up and glowing up 🌟.,"['visitsingapore', 'passionmadepossible', 'singapore', 'traveltok', 'marinabaysands']",398.4K,9578,5222,2533,"Singapore in 2008, Singapore in 2023"
28_post,https://www.tiktok.com/@ianjeevan/video/7230004360099515650,Ian Jeevan,1507,187.9K,8.7M,2023-5-6,/@ianjeevan,ianjeevan,I’ve always wanted to try taking a first class coach to KL! Finally got the chance to do this last week!,"['transtartravel', 'bus', 'singapore', 'kualalumpur', 'firstclassbus', 'ianjeevantravels', 'malaysiatravel', 'singaporetravel']",52.4K,9750,9458,421,come for me on the first class bus from Singapore to KL for just 45 dollars so the journey began at 7:00 a.m. at lavender MRT Station where we got picked up by this random bus. Which brought us the location where we then transferred to our first class bus so this is how the First Class Bus looks like it's a double-decker bus the seats are equipped with the TV a massage chair ample legroom and comfortable seats so we headed to fast track flights and cross the highway this is pretty smooth with all our baggage. I bought some snacks and then we rebooted the bus and that's where we were served our meal which honestly was not bad I would say you can also request for blankets water bottles and snacks at any point of time so the journey to care took about six and a half hours we finally reached by Times Square around 1 p.m. follow me for more travel content
29_post,https://www.tiktok.com/@goodtoflynews/video/7244495716662447367,GoodtoFly ✈️,5,3367,596.7K,2023-6-14,/@goodtoflynews,goodtoflynews,a little inside trick for you 😉,"['singaporewards', 'singapore', 'visitsingapore', 'travel', 'goodtofly']",2609,1008,430,24,"this is how i got free entry to singapore zoo / sea aquarium. cutie animals, download the visit singapore application, click on singaporewards, many experiences for you to choose from"
30_post,https://www.tiktok.com/@kevandchen/video/7163838396375239938,Kev and Chen,171,10.3K,166.9K,2022-11-9,/@kevandchen,kevandchen,The efficiency in this country’s transport system. 🤩,"['singapore', 'singapore2022', 'singaporetravel', 'travelsingapore', 'mrtsingapore', 'fyp', 'fypph', 'sanall']",32.9K,1583,1719,168,Reloading mrt cards in SG
31_post,https://www.tiktok.com/@daddy.xj/video/7225251643175079169,daddy.xj,408,8896,130.2K,2023-4-23,/@daddy.xj,daddy.xj,✨[SAVE THIS AND TRAVEL LATER]✨,"['universalstudiossingapore', 'rwsmoments', 'resortsworldsentosa', 'sentosaislandsingapore', 'travelsingapore', 'exploresg', 'traveltip', 'travelhack']",11.8K,3905,644,48,this is something that you wish to know before you visit Universal Studios Singapore you can collect this free photographs around USS and exchange them at the end of the day but the fact is most people will think they are rubbish and just throw them away here are some ways you could collect this response and maximize the benefits out of this. go to all the characters meet and greet section in the park obviously you will get a photo wristband not many know that you can also stop by this stationary photo booths like this Transformer team where they provide the response on selected right you could also ask if they ever respond after you took that right after you have collected at least 10 reasons bring this week's bands to the photography studio here and they will consolidate all photos for you by the way after stuff to take photo of you and they are Green Screen to they allow you to use your phone and take photos of the photos but if you really like the photos you could purchase All Digital copies at the flat rate I think it is 35 dollars nowyou now have the memories of your USS trip which you can download later.
32_post,https://www.tiktok.com/@aemilst/video/7244184348130282760,ems,2,2.4M,79.9M,2023-6-13,/@aemilst,aemilst,honeymoon ✈️💗,"['singapore', 'universalstudiosingapore', 'travel', 'viral']",256.7K,15.6K,383,731,universal studios
35_post,https://www.tiktok.com/@kevouthere/video/7234015985651485970,Kev,270,115K,4M,2023-5-17,/@kevouthere,kevouthere,Singapore through my eyes,"['foryou', 'singapore', 'aesthetic']",54.3K,8228,837,286,
36_post,https://www.tiktok.com/@tanzheexuann/video/7197264108641701122,tanzheexuan,306,1740,141.1K,2023-2-7,/@tanzheexuann,tanzheexuann,extremely thankful for my daddy 🥹,"['sg', 'foryou', 'singapore', 'travel']",35.5K,1236,161,37,traveling with my dad vs without
37_post,https://www.tiktok.com/@kerrynlee/video/7214849855557012738,小欣 Kerryn Lee,298,28.2K,1M,2023-3-26,/@kerrynlee,kerrynlee,Would you pay SGD1350/2pax to travel to Malaysia via cruise? All meals inclusive tho👀,"['tiktoksg', 'fyp', 'resortworldcruises', 'resortsworldone', 'rw1', 'readysetsail', 'myrwcexperience', 'travel', 'singapore', 'sgfoodie', 'date', 'visitsg', 'exploresg']",4051,638,899,92,"cruise from Singapore to Malaysia this is results worldwide is the new vessel with 13 decks they can fit 1856 passengers with 928 State rooms I took a 4839 package for the cruise does a trip from Singapore to Port Klang Penang and then back to Singapore there are a few types of room and they all come in different prices we got the balcony stateroom it was around 1,350 for the both of us including mandatory Port charges and go to this price includes five meals a day and inclusive restaurants on some fun activities and performers with that being said no extra charges unless you want to do or eat in a restaurant that is not in the inclusive list. oh yes what is not included you have to pay for it unless you can survive without Wi-Fi for 4 days throughout the entire Journey you have to carry your key card with you all the time it's like a credit card you'll be charged if you do or eat something exclusive payment can be made when you check out on the last day even though the cruise stopped at Port Clinton we did not get down and we were allowed to spend a few hours in Penang. and then interesting thing is that before we bought the cruise they collected all our passport so we were actually aroundI hope this video gives you an idea of where to go for the next travel destination let me know if you have any questions about the cruise for me for more and I'll see you in my next video bye-bye"
38_post,https://www.tiktok.com/@sahdiyaeducates/video/7108797169292905733,SAHDIYA 𝐄𝐃𝐔𝐂𝐀𝐓𝐄𝐒,80,35.1K,904.3K,2022-6-13,/@sahdiyaeducates,sahdiyaeducates,So I spent two weeks in Singapore and here’s what I recommend,"['singapore', 'visitsingapore', 'traveltok', 'mustdo', 'traveltok', 'sciencewithsahdiya', 'food', 'travel', 'marinabaysands', 'gardensbythebay', 'tanjongbeachclub', 'chinatownsingapore', 'stellaseasidelounge', 'artsciencemuseum', 'hajilane', 'arabstreet']",8949,6321,1239,61,I spent two weeks in Singapore and here's what I recommend you do Marina Bay Sands is the one then walk to Gardens by the bay and the science museum at Stella Seaside Lounge reviews and the food. it's just more immerse yourself in the beauty of Arab Street and haji Lane. visit Chinatown get lunch at tanjong beach club oh my God it's just beautiful.  make sure you do sunset yoga at the top of Marina Bay Sands
