id,url,account_name,following_count,follower_count,total_like_count,date,href,handle,description,hashtag,like_count,bookmark_count,share_count,comment_count,final_text
307_post,https://www.tiktok.com/@peltings/video/7230051909913087250,alayna 😛,74,2772,25K,2023-5-6,/@peltings,peltings,Watch this guide before you head to Bird Paradise!! 🏃🏻‍♀️🕊️ Get your tickets from Klook & enjoy $5 off with my discount code ‘AL2HPG’ 🤪,"['birdparadise', 'jurongbirdpark', 'travelsingapore', 'singaporeplacestogo', 'trendingsingapore']",1981,533,552,46,"here are some useful tips when you visit singapore's new bird paradise. firstly transport. if you are taking the bus alight at the correct place because there are now two bus stops to mandai one is for bird paradise and the other is to the zoo river wonders and night safari. if you drive you can park your car at bird paradise. number two getting around the park. i dont think mandai offers a physical map anymore so you have to download their app tram rides are free and they also have rental services for wheelchair trike and wagon. number three feeding birds highly recommend this there are specific feeding times for the birds and if you like to get up close with them you will need to book a slot online first and its 8 dollars per pax. number 4 food and drinks well bird paradise is a tourist spot so everything there is expensive. there are many f&b options inside and outside the park and for those outside they have starbucks banana leaf a and w and many more. we also have snacks and drinks in the park but a can of soft drink is 3 dollars and ice slushy is 9 dollarsso you know what just bring your own drinks. last but not least the weather is super hot but there are quite a number of air conditioned places for you to chill. if there is a lightning alert however, you will not be able to see the birds at the sanctuaries so plan your trip and try to avoid a wet weather day. you can purchase this ticket on klook and use my discount code to get 5 dollars off your ticket price have fun guys"
308_post,https://www.tiktok.com/@tfnyk/video/7240359233177406727,Tiffany 🌱,346,1479,23.7K,2023-6-3,/@tfnyk,tfnyk,"Bukit Awan, the cloudy hill 😶‍🌫️","['biketok', 'fyp', 'bukitawan', 'malaysia', 'pahang', 'singapore', 'ridewithus', 'ktm1290', 'travel', 'intheclouds']",2241,287,146,41,
309_post,https://www.tiktok.com/@robertaconmaleta/video/7205804929611500805,Roberta Con Maleta,533,717.2K,10.6M,2023-3-2,/@robertaconmaleta,robertaconmaleta,"Singapur, pero BARATO 💰 aquí te digo cómo hacerlo 🙌🏼 ","['singapur', 'singapore', 'traveltiktok', 'travelbucketlist', 'viajesbaratos']",3883,904,174,18,free walking tour episode
311_post,https://www.tiktok.com/@tiktokforbusinesssea/video/7251489628920777985,TikTok for Business SEA,47,891.1K,1.5M,2023-7-3,/@tiktokforbusinesssea,tiktokforbusinesssea,TikTok is the trip before the trip! ✨✈️,"['learnontiktok', 'travelhacks']",172.6K,371,20.1K,6139,consumers get to take the trip before the trip but it means that true Discovery you have the opportunity to create the intent to travel one major major learning that I really want to share everyone is that I think brands have to be prepared to really invest not just the app dollars or the Manpower but in the content creation the creases a real Travelers that authenticity video happens everywhere and I think it's really about capturing those whole country and connecting to destination with audiences
312_post,https://www.tiktok.com/@benyaap/video/7166839541117078785,Ben yap,58,592,21.6K,2022-11-17,/@benyaap,benyaap,Am I misunderstanding travel insurance?,"['tokyo', 'narita', 'naritaairport', 'flightcancelled', 'travel', 'travelinsurance', 'travelinsurancetips', 'zipair', 'zipairtokyo', 'zipair%23ロサンゼルス', 'japanairlines', 'singlife', 'how', 'singaporeairlines']",9935,640,1347,338,so recently my flight was cancelled one hour into flying from Tokyo to Singapore due to a plane malfunction and we had to return back to Narita Airport so the question is what does travel insurance cover. am i misreading something please send help
313_post,https://www.tiktok.com/@xstirlz/video/7186647614648093954,Stirling,271,160,8435,2023-1-9,/@xstirlz,xstirlz,"Here for work in Singapore and I stumbled across the perfect date spot! This is LUMI F&B and I highly recommend it! It’s still quite empty at night but hopefully that changes soon! The staff were honestly so friendly! Singaporeans, what should I try next? I forgot to mention that they have a $6.50 lunch menu and it looks damn good 🤤 ","['lumi', 'hiddengemsingapore', 'halal', 'singapore', 'sg', 'sgtiktok', 'sgfoodie', 'foodreview', 'travel', 'australia', 'jasonyu']",8305,3853,1028,46,hidden gem in singapore Bistro and has such a nice vibe from the Neon Lights of the smooth R&B music it's honestly just a perfect day but let me off this Burgers pasta meet seafood or more and that's all hello and for my fellow 90s kids out there doesn't just bring you back to the Windows media players upstairs is a pool and karaoke room but I want you to my singing today but maybe I'll come back with a friend and told you that I got the seaweed and the truffles singaporeans what should I try next
314_post,https://www.tiktok.com/@jforjpeg/video/7225601097560247560,jayohhel,71,1142,66.6K,2023-4-24,/@jforjpeg,jforjpeg,Replying to,"['nature', 'singapore', 'sgtiktok', 'fyp', 'foryou', 'goviral', 'travel']",4025,539,1003,146,makes me feel alive
315_post,https://www.tiktok.com/@thefelixwee/video/7210610509601688834,Felix W,3,704,15.9K,2023-3-15,/@thefelixwee,thefelixwee,I know many of you are huge fans of the A380(myself included) Here is the full tour of the Singapore Airlines King of the skies✈️,"['singaporeairlinessuites', 'businessclass', 'premiumeconomy', 'singaporeair', 'flysq', 'singaporeairlines', 'economyclass', 'firstclass', 'instatravel', 'milesbetterwithkf', 'a380', 'airbus380', 'planespotter', 'travelinstyle', 'sq', 'igsg', 'wingview', 'avgeek', 'instaaircraft', 'travelgram', 'changiairport', 'aviationdaily', 'lifewelltravelled', 'staralliance', 'fyp', 'sqtalk', 'aviation', 'aviationlovers', 'igtravel', 'travelbug']",12.4K,1223,721,41,full tour of singapore airlines a380 in 45 seconds. at the front of the second level you have the gorgeous suites cabin. occupying the rest of the second level is the business class cabin. now lets head down to economy and lastly we end off with the premium economy cabin
316_post,https://www.tiktok.com/@jyyyntot/video/7221825442976730374,The Millennial Gastadora,388,731,34.1K,2023-4-14,/@jyyyntot,jyyyntot,Wish I could have the chance to live here,"['fyp', 'foryou', 'foryourpage', 'fypageシ', 'foryoupage', 'foryoupagе', 'singapore', 'traveltok', 'sgtiktok', 'sg', 'singaporetiktok', 'traveltiktok', 'travel2023', 'traveltipssingapore', 'travelguidesingapore', 'minivlog', 'minivlogs', 'tipsandhacks']",6954,4585,925,167,"useful things to know before visiting singapore part 2 get an ezlink card. if you will ride the mrt or lrt best to get an ezlink card. you ca use this card on both train system. cost per ride is from 099 sgd to 1.99 sgd. know the laws of the land. littering jaywalking smoking and chewing gum are some of the things prohibited in sg. be sure to know the laws and rules of sg to avoid harsh sanctions and heavy penalties. internet options. there are a lot of wifi hotspots in sg which you can utilize for free, you can also purchase a sim card at changi airport to connect to the internet. 10gb data is enough to a 3-4 days stay in sg. know the best place to stay. if you are looking for a best place to stay that is accessible to all, i would recommend chinatown. book your accomodation here if you want to be near cheap food joints hawkers cheap souvenir stores and famous attractions. buy express or skip the line passes. tourist flock sg in droves so buying express tickets will save you more time and money you can visit more attractions in a day if you will use express tickets. claim your tax refund gst. as a tourist in singapore if you make any purchase of more than 100 dollars at participating shops you may claim a refund on the 8 percent goods and services tax paid. this is known as the tourism refund scheme. you can collate up to three same day receipts or invoices to meet a minimum purchase amount of 100 dollars these receipts should be from the same gst registration number and shop name."
317_post,https://www.tiktok.com/@taybeepboop/video/7186718691353005354,TayBeepBoop,216,1.9M,66.3M,2023-1-9,/@taybeepboop,taybeepboop,I picked a horrible video for the food part but I PROMISE i have better footage 😂 & the center is actually a WATERFALL but we happened to be there during the 5 days of maintenance this year. 10/10 Singapore airport has been my favorite airport experience of my life. Traveling there was well worth it!,['travel'],2.9M,339.3K,65.5K,11.6K,this was the best travel experience of my life we purposely picked a 14-hour layover in the Singapore airport and it's the coolest place I've ever been they have a net system across most of the top floor and you can bounce and walk on it the ground is foggy the food is amazing do you see that bridge up there that's a glass for bridge and I walked over it and my stomach dropped I can't accurately show how scary it is we felt like kids again I've never had so much fun there's this Mirror Maze and I promise you they were points where I didn't know which was the real Andrew just about what we spent on because it's so freaking scary I accidentally dropped my ticket and pick it up look at how many floors down this goes and weirdly there is a giant Avatar set up and Andrew was obsessed with it he bought this t-shirt it closed in the darkplay as do I oh and there's a pool
318_post,https://www.tiktok.com/@nuvegroup/video/7234368129919585538,NuVe Group,8,533,6891,2023-5-18,/@nuvegroup,nuvegroup,"Elevate your stay with our loft rooms, and spacious rooms with balcony, located just 3 minutes🚶‍♂️from Bendemeer MRT station 🚇 and surrounded by many cafes ☕️ and food offerings! 🥘","['harbourvillehotel', 'nuvegroup', 'harbourvillehotelhamilton', 'traveltok', 'travel', 'exploresingapore', 'visitsingapore', 'discoversingapore', 'singapore', 'sg', 'hotelsg', 'fyp', 'tiktoksg']",1154,369,113,0,
319_post,https://www.tiktok.com/@dinkomotv/video/7232613235344559365,Kofi Di Nkomo,37,9237,15.8K,2023-5-13,/@dinkomotv,dinkomotv,Work In Singapore 🇸🇬🇸🇬 for free…,"['tiktokghana🇬🇭', 'trending', 'travel', 'viralvideo', 'viraltiktok']",1917,235,149,0,work in Singapore for freeit was southeast Asia southeast Asia cupmake an appointment in the Singapore in the Singapore so let's zoom in Singapore and Southeast Asia currency in SingaporeCarpenter Nation Street
320_post,https://www.tiktok.com/@thebeaulife.co/video/7236559622675369217,thebeaulife.co,1,2381,100.6K,2023-5-24,/@thebeaulife.co,thebeaulife.co,Get groovy with it! The,"['sgnews', 'sgtiktok']",4083,769,553,2,we found a mini disco inside this museum no guest list required? this is part of the national museum of singapore latest travel themed exhibition. this explores the country's role as a travel hub and how it has evolved over time. its the iconic changi airport flight info display board. families and kids you should also check out the all about food series. learn about singapore's food identity from past to present
321_post,https://www.tiktok.com/@kerrynlee/video/7250115757659426066,小欣 Kerryn Lee,298,28.2K,1M,2023-6-29,/@kerrynlee,kerrynlee,Bringing hawker food to another level😋📍The Bedok Marketplace,"['singapore', 'sgfoodie', 'fyp', 'bedok', 'eastsidefoodie', 'foodrecommendation', 'hawker', 'hawkerfood', 'visitsg', 'sgtravel']",558,216,192,33,if you live in singapore but you havent been to this hawker centre in bedok you are missing out. look at the food it is so different from the usual hawker centre food. the food quality and portion is amazing follow me for more bye bye
323_post,https://www.tiktok.com/@andsheblooms/video/7171323444523584795,Shifa’s Journey ✈️🌎,42,54.2K,1M,2022-11-29,/@andsheblooms,andsheblooms,Replying to,"['singaporetravel', 'solotravel', 'solotrip', 'traveltiktok', 'singaporevlog']",2652,1324,97,44,"day 2 singapore trip Lavender Wisma Atria blanco food court mr coconut ice cream orchard road raffles place, one fullerton"
324_post,https://www.tiktok.com/@reseaseo/video/7114092566483602715,Therese A.,78,370,11.2K,2022-6-28,/@reseaseo,reseaseo,"Tara, SG! 🇸🇬 ","['singapore', 'filipino', 'pinoy', 'pinay', 'fyp', 'wheninmanila', 'travel', 'filipina', 'changiairport', 'naia', 'revengetravel']",5040,1131,1096,161,here are the requirements for travel to Singapore as of June 2022 days before the departure at the earliest and the trees together at the register your details prior to entering immigration no need for pre-departure a r t
325_post,https://www.tiktok.com/@marifranceri/video/7217713079260335366,MARI FRANCERI 🐇,136,77.3K,951.4K,2023-4-3,/@marifranceri,marifranceri,places to go in singapore: national gallery museum! entrance fee & directions in the video 🖼️,"['singapore', 'museum', 'art', 'edutok', 'tiktoksg', 'travel', 'traveltok', 'nationalgallerysingapore', 'travellife', 'sg', 'fyp', 'foryou', 'singaporetravel2023', 'singaporeplacestogo', 'singaporeoutfits', 'singaporetravelrequirements', 'singaporeeats', 'travelvlog', 'singapore', 'sgtiktok', 'vlog', 'brightstarhotel', 'budgethotel', 'budgetsingapore', 'airbnb', 'travel', 'sg', 'travelbudget', 'budgettravel', 'traveltips', 'hajilane', 'arabst', 'haji', 'fyp', 'foryou', 'jetstar']",429,259,54,12,hi guys so this is late too out of five of our travel here in Singapore and we went to the National Gallery my college course was actually multimedia Arts will definitely I love that I get to appreciate you are again if you go here via MRT these are the streets and the landmarks that you have to go to just remember City Hall and Coleman Street drawings of faces of people and apparently these are the citizens of Singapore National Museum which is different from this one the other have a lot of food in the area like this one which is very aesthetic and we actually discovered this area which had the whole view of Marina Bay it's so pretty periodexperimented with different papers and the textures and brushes this is my favorite artwork by the way it's box and it's so beautiful for me so this gallery that I'm headed to is called living pictures photography and Southeast Asia so it's basically an appreciation of Photography and history also exploring the changing rules of Photography and Southeast Asia so from Walmart and then it comes to the Modern Age like me such as this one and other things that is used for personal use like this photo of different personal items we also showcase a lot of different photos here as well the gallery and everywhere and how it shipsshe described her work as a container for everything that does not make sense like in the Philippines this one's also pretty cool and funny and artist edited himself into historical pictures that they have in Singapore I just know these are monks now this is a bit since we had to go to the next menu this is the first floor and it shows a lotsearch for the cartoon proceedings this was restricted area before they were also tunnels and tractors we didn't get to explore but yeah hope you get to visit that next time so I hope this help you guys could definitely I love being here and I love being around Earth yeah I'll be uploading more videos later
326_post,https://www.tiktok.com/@nuvegroup/video/7236739916888034562,NuVe Group,8,533,6891,2023-5-24,/@nuvegroup,nuvegroup,Book direct on our website to celebrate your special occasion with us! 🎉,"['hotelnuveheritage', 'nuvegroup', 'travel', 'traveltok', 'exploresingapore', 'visitsingapore', 'discoversingapore', 'singapore', 'sg', 'hotelsg', 'fyp', 'tiktoksg']",1264,362,115,7,
327_post,https://www.tiktok.com/@earthexplored/video/7026256328561609990,Earth Explored,141,83.4K,2.9M,2021-11-3,/@earthexplored,earthexplored,Singapore is AMAZING 🤩 Worth more than just a layover 👀,"['travel', 'singapore', 'traveltiktok', 'fyp', 'gardensbythebay', 'marinabaysands', 'top5', 'wanderlust']",1515,700,240,7,"TOP 5 THINGS To Do in singapore shopping at marina bay sands, artwork at haji lane, botanical gardens, cloud forest, supertree grove"
328_post,https://www.tiktok.com/@emceeanandk/video/7239529298590223634,emceeanandk 🧿,622,1101,18.5K,2023-6-1,/@emceeanandk,emceeanandk,Maha Kumbabishegam 2023!,"['kumbabishegam', 'murugan', 'lordmurugan', 'singapore', 'beautiful', 'tankroad', 'culture', 'indianculture', 'positivevibes', 'videography', 'travel', 'viralindian', 'festival', 'trendingtiktokviral', 'trending', 'fyp', 'fyppage', 'hindu']",1882,69,412,24,sri thendayuthapani temple singapore
329_post,https://www.tiktok.com/@henryhaydi/video/7250086647034023173,✈️🍔Lăn cùng Ry🍭✈️,7,647.5K,6M,2023-6-29,/@henryhaydi,henryhaydi,"Ngày 3 khám phá hết mọi ngóc ngách của Singapore, nhớ ghé khu China Town và Tanjong Pagar nha mọi người, siêu đẹp lungggg 🇸🇬🇸🇬🇸🇬","['singapore', 'chinatown', 'tanjongpagar', 'travel', 'dulichsingapore', 'dulich', 'singaporetiktok', 'learnontiktok', 'ancungtiktok', 'visitsingapore', '🇸🇬']",28.6K,1169,478,126,singapore day 3 Tanjong Pagar Little Islands  Tanjong Pagar Plaza SINGAPORE ART MUSEUM
330_post,https://www.tiktok.com/@q00kies/video/7246349504591580434,qilaa ( ᵔ︡ - ᵔ︠ ),168,345,101.6K,2023-6-19,/@q00kies,q00kies,this is a sign for you to go for singapore day trip with your frens 🫢,"['fyp', 'fypシ', 'singapore', 'singaporedaytrip', 'tiktoktravel']",4668,1060,117,67,merlion park singapore day trip
331_post,https://www.tiktok.com/@corrainespov/video/7219223322737839386,CORRAINE5OFF | KLOOK DISCOUNT,134,606,25.6K,2023-4-7,/@corrainespov,corrainespov,Travel Hacks I wish I knew before going to Singapore in 2023!,"['traveltok', 'traveltiktok', 'fyp', 'fyppppppppppppppppppppppp', 'fypage', 'singaporetiktok', 'travelhacks', 'travelhack', 'traveltips', 'traveldiaries', 'sgfyp', 'pinaytraveler', 'travelingtosg', 'foryou', 'pinaytiktokers🇵🇭']",2217,1719,201,47,travel hacks i wish i knew before i went to singapore 2023 arrive early in sg and avoid arriving at midnight taxi fares get crazy high at that time. buy ezlink cars as early on your first day. they can be found on the airport and 711 stores buy a simcard at the airport on your first day. roaming services of postpaid plans are so expensive
332_post,https://www.tiktok.com/@abunawas.travel/video/7247119944385727750,Abunawas.travel,13,12.5K,74.3K,2023-6-21,/@abunawas.travel,abunawas.travel,Yess Akhirnya Update video group ke 87,"['abunawastravel', 'abunawas', 'abunawastravel2022', 'abunawastravel2023', 'tourtiganegara', 'tourtiganegaramurah', 'trip3negara', 'trip3negaramurah', 'trip3negarapromo', 'tour3negara', 'tour3negaramurah', 'tourhalal', 'tourasia', 'tourmalaysiasingapore']",3843,1,36,20,
333_post,https://www.tiktok.com/@hilmzeats/video/7253681428335004929,Hilmz | Hotel & Food,191,19.9K,645.9K,5d ago,/@hilmzeats,hilmzeats,Replying to,"['traveltok', 'sgtravel', 'exploremalaysia', 'travelmalaysia', 'kualalumpur', 'singaporetomalaysia', 'sgtiktok']",704,134,60,7,bus from Singapore to KL I took this basket luxury coach and the pickup Point Hotel near Rubicon MRT the seats are pretty basically configuration and they were relatively clean this is not the usual luxury coach buses because the normal buses have seats in 2 and 1 configuration and their way more special than this but I knew this beforehand because I could select 7:30 p.m. the bathroom
334_post,https://www.tiktok.com/@fortress3091/video/7171927540385221890,jayjay,2699,1358,3975,2022-11-30,/@fortress3091,fortress3091,Planning to visit Singapore? It's always better to be over prepared than under prepared.,"['singaporetravel2022', 'singapore', 'singaporetravel', 'travelrequirements🇵🇭', 'philippinestosingapore']",91,27,19,44,planning to visit singapore sg arrival card flight itinerary return ticket  hotel accomodation fully vaccinated itineraries travel insurance optional company id coe if employed attraction booking optional
335_post,https://www.tiktok.com/@aarivu90/video/7244145949004549378,அ.அறிவழகன்,9846,18.2K,551.8K,2023-6-13,/@aarivu90,aarivu90,%,"['100', '100k', '100', 'true', 'trending', 'trend', 'travel', 'malaysia', 'truestory', 'tamil', 'speak', 'tamilspeech', 'speech', 'india', 'singapore', 'cwc', 'cookwithcomali', 'vijaytv', 'sivangi', 'free', 'time']",8030,707,86,107,
336_post,https://www.tiktok.com/@gr3atdna/video/7235666452894797057,dee,124,8832,210.4K,2023-5-21,/@gr3atdna,gr3atdna,Singapore day trip 🇸🇬,"['minivlogtravelling', 'tripwithfriends']",9059,1145,228,70,
337_post,https://www.tiktok.com/@ye_.n/video/7210812468321340690,Yein🐰,68,1098,533K,2023-3-15,/@ye_.n,ye_.n,So used to travel to different countries with my Visa-free Singapore passport only to panic realising that I have to do this before my flight in less than 48 hours! Don’t be like me! Thank god my application was approved fast!,"['fyp', 'korea', 'koreatravel', 'koreatrip', 'koreantiktok']",803,452,100,18,PSA For those travelling to South Korea Even if you are from visa free countries like Singapore you HAVE TO apply for this electronic travel Application and approval might take up to 72 hours or more Some were pretty instant But take no chances
338_post,https://www.tiktok.com/@leachan7/video/7205931114995666177,Lea_Chan,40,150.6K,3.2M,2023-3-2,/@leachan7,leachan7,មកលេង Singapore ហូបមីពងទាប្រៃល្បីប្រចាំប្រទេសសឹង្ហបុរី​ឆ្ងាញ់ដល់ថ្នាក់ហ្នឹង?? 😳🍝,"['singapore', 'besoma', 'travel', 'food', 'noodle', '7eleven', 'fyp', 'foryoupage', 'cambodia', 'explore']",24.4K,1150,100,26,IRVINS SALTED EGG FLAVOUR Living my best life through food  Central Market in Cambodia Chinatown Food Centre Marina Bay Sands  Maxwell Food Centre Rating ice creams from 7 Eleven Malaysia
339_post,https://www.tiktok.com/@kerrynlee/video/7227861962418375937,小欣 Kerryn Lee,298,28.2K,1M,2023-4-30,/@kerrynlee,kerrynlee,"How to get a local sim card in China as a foreigner🇨🇳 If you’re visiting China, save this video‼️You’re welcome😙 ","['tips', 'travel', 'china', 'beijing', 'fyp', 'chinatraveler', 'sgtravel', 'asia', 'hacks', 'singapore', 'sgfoodie', 'tiktoksg']",16.1K,7065,1089,174,these are the things I need to know and prepare before going to China number one get your visa done filling the health declaration form before you bought your flight number two get your sim card ready you can choose to buy roaming or use a local China SIM card the good thing about roaming is that you don't need VPN you can access Instagram tiktok Google or telegram as per usual but without a local SIM card you can't use most of the public Wi-Fi because they will need a verification code some apps are require you to have a local number to register most local only allow you to get a Chinese SIM card if you are resident here however I found out that provides for foreigners you can order it online before your trip to the hotel activate the SIM card online with your passport Visa entry to go lastly recommend downloading this app because they'll be very helpful during your trip I hope you learned something new today hold me for more and I'll see you in my next video bye-bye
340_post,https://www.tiktok.com/@alexgodevil/video/7254499168507399425,毒霸天下,9875,13.5K,310.7K,2d ago,/@alexgodevil,alexgodevil,,"['fyp', 'fypシ', 'fypシ゚viral', 'sgtiktok', 'sgnews', 'yishun', 'sembawang', 'mediacorp', 'school', 'childhood', 'childhoodmemories', 'memoriesbringback', 'memories', 'mediacorp', 'primaryschool', 'childhoodmemories', 'sgnewsupdate', '歌曲分享', '小时候', 'malaysia', '小时候', 'cna', 'fypage', 'tvb', 'mediacorp', 'channel5', 'channel8', '经典老歌', 'sgnews', 'sgtiktok', 'sg', 'sgfoodie', 'sgtt', 'mothershipsg', 'stomp', 'zaobaosg', 'shinmindailynews', 'memories', 'memoriesbringback', 'memoriesareforever', 'singapore', 'singaporetiktok', 'childhood', 'childhoodmemories', 'children', 'backtothepast', 'memoryunlocked', 'histroy', 'histroychannel', 'foryourpage', 'singaporeimagine', 'taiwan', 'ndp', 'sgtravel', 'airlinepilot', 'airlinetiktok', 'singaporetrending', 'jb', 'today', 'malaysia', '小时候', '歌曲分享', '长大', '中国']",1208,186,1162,110,Old Histroy of Sembawang Chong Pang Village
341_post,https://www.tiktok.com/@goodmorlinn/video/7251591591327010055,Linne,69,32.8K,168.8K,2023-7-3,/@goodmorlinn,goodmorlinn,😓Ops hehe,"['weekend', 'fyp', 'pov', 'foryoupage', 'foryou', 'fy', 'funny', 'cycling', 'exercise', 'fitness', 'satay', 'cyclist', 'nightride', 'dinner', 'singapore', 'fittok', 'foodie', 'foodtiktok', 'bicycle', 'bbq', 'gilrs', 'foodlover', 'travel', 'fypage', 'fitnessmotivation', 'sgtiktok']",6260,732,358,125,Accidentally Exercise to lau pa Sat
342_post,https://www.tiktok.com/@shenzhensg/video/7222700154619481345,强盛集团,7627,25.9K,465.2K,2023-4-16,/@shenzhensg,shenzhensg,,"['panda', 'singapore', 'china', 'chinatikok', 'funny', 'meme', 'cute', 'cutes', 'lol', 'laugh', 'laughoutloud', 'travel', 'sichuan', 'shit']",13K,563,832,546,
343_post,https://www.tiktok.com/@garyaroundtheglobe/video/7248459890966940933,Gary Around The Globe,16,290,10.2K,2023-6-25,/@garyaroundtheglobe,garyaroundtheglobe,Welcome to Singapore Changi Airport 🇸🇬😍,"['singapore', 'airport', 'changi', 'travel', 'amazing', 'waterfall', 'jewell', 'goexplore', 'roamtheplanet', 'postcardsfromtheworld']",9856,1288,1941,261,SINGAPORE CHANGI AIRPORT
